{
  "case_id":"N10-BRITTLE-FRACTURE-GUIDED-EXAMPLE",
  "standard":"СП 16.13330.2017",
  "action":"brittle_fracture_guided",
  "route":{
    "kind":"section13_full_review",
    "design_yield_resistance_n_mm2":240.0,
    "welded_structure":true,
    "steel_selection_5_2_table_v1_confirmed":true,
    "stress_concentration_and_work_hardening_reduction_confirmed":true,
    "solid_web_vs_lattice_concentration_considered":true,
    "weld_zone_tensile_stress_n_mm2":110.0,
    "enhanced_ndt_for_welds_above_0_4_ry_confirmed":true,
    "weld_intersections_avoided_confirmed":true,
    "runoff_tabs_and_weld_ndt_confirmed":true,
    "cover_plate_splice_with_flank_welds":true,
    "flank_weld_termination_distance_each_side_mm":25.0,
    "guillotine_cutting_or_punched_holes":false,
    "secondary_gusset_to_tension_member":false,
    "steel_grade_number":355.0,
    "plate_thickness_mm":30.0,
    "joint_type":"tee",
    "through_thickness_tension":true,
    "clause_13_3_engineering_review_confirmed":true,
    "lamellar_tearing_assessment_required":true,
    "through_thickness_test_evidence_available":true,
    "selected_z_quality_certificate_confirmed":true,
    "connection_form_case":"corner_full_penetration",
    "risk_weld_leg_mm":8.0,
    "restraint_level":"high_rigid_no_shrinkage",
    "pass_count":"one",
    "weld_sequence":"one_side_then_other",
    "preheat":"without_preheat",
    "through_thickness_action":"none",
    "construction_group":2,
    "consequence_class":"KS-2",
    "flange_connection_15_9_10_or_force_normal_to_plate":false,
    "selected_z_quality_group":"Z25"
  }
}
